{
	"$schema": "../schema.json",
	"name": "Dashy",
	"description": "Configurable start page for self-hosted services.",
	"image": "lissy93/dashy",
	"tag": "latest",
	"containerPort": 8080,
	"icon": "di:dashy",
	"tags": ["dashboard", "start-page", "bookmarks"],
	"websiteUrl": "https://dashy.to",
	"sourceUrl": "https://github.com/Lissy93/dashy",
	"envVars": {}
}
