{
	"$schema": "../schema.json",
	"name": "PrivateBin",
	"description": "Zero-knowledge pastebin: pastes are encrypted in the browser, the server never sees them.",
	"image": "privatebin/nginx-fpm-alpine",
	"tag": "2.1.0",
	"containerPort": 8080,
	"icon": "di:privatebin",
	"tags": ["pastebin", "encryption", "sharing"],
	"websiteUrl": "https://privatebin.info",
	"sourceUrl": "https://github.com/PrivateBin/PrivateBin",
	"envVars": {},
	"volumes": ["/srv/data"]
}
